{
  "schema_version": 1,
  "game_id": "q728",
  "version": "v1",
  "internal_title": "Asterism Gradient",
  "public_title": null,
  "author_partition": "gpt",
  "authorship": {
    "model_family": "OpenAI GPT-5",
    "model_snapshot": "current Codex task model; exact deployment id not exposed to task",
    "session_id": "01a02a2e-aaf5-7e90-a559-46437ace2edb",
    "created_at": "2026-08-30T00:00:00Z",
    "source_lineage": [
      "research/gpt-ideas-v2.tsv:q728"
    ],
    "source_commit": null
  },
  "mechanics": {
    "primary": "conserved-phased-distribution-with-evidence-preserving-reset",
    "secondary": [
      "gradient-threshold",
      "experiment-execution-separation"
    ],
    "novelty_claim": "Asterism Gradient",
    "closest_prior_art": [
      "research/coverage-gap-study-v1.md",
      "research/flash-game-mechanics-survey.md"
    ]
  },
  "failure_modes": [
    "changes total influence",
    "forgets target phase",
    "resets before crossing the probe threshold"
  ],
  "interface": {
    "actions": [
      1,
      2,
      3,
      4,
      5,
      6
    ],
    "observation": "64x64x16",
    "deterministic": true,
    "seeded_stochasticity": false
  },
  "progression": [
    {
      "level": 1,
      "role": "orient",
      "new_demand": "Conserved Influence",
      "composes": []
    },
    {
      "level": 2,
      "role": "discriminate",
      "new_demand": "Capacity and Phase",
      "composes": [
        1
      ]
    },
    {
      "level": 3,
      "role": "plan",
      "new_demand": "Gradient Threshold",
      "composes": [
        1,
        2
      ]
    },
    {
      "level": 4,
      "role": "compose",
      "new_demand": "Experiment Then Execute",
      "composes": [
        1,
        2,
        3
      ]
    },
    {
      "level": 5,
      "role": "inhibit",
      "new_demand": "Precessing Relation",
      "composes": [
        1,
        2,
        3,
        4
      ]
    },
    {
      "level": 6,
      "role": "synthesize",
      "new_demand": "Asterism Gradient",
      "composes": [
        1,
        2,
        3,
        4,
        5
      ]
    }
  ],
  "visual_identity": {
    "dominant_palette": [],
    "silhouette_grammar": "White influence climbs pink star columns across a blue orbital chart and green phase rail.",
    "spatial_grammar": "White influence climbs pink star columns across a blue orbital chart and green phase rail.",
    "motion_grammar": "conserved phased distribution with evidence preserving reset",
    "hud_grammar": "Persistent colored state markers expose the mechanic without text.",
    "nearest_visual_games": []
  },
  "evaluation": {
    "allowed_development_models": [
      "deterministic-solvers",
      "random-fuzzer",
      "Qwen3.8 diagnostic only"
    ],
    "held_out_evaluator": "anthropic",
    "human_baseline_status": "not_started",
    "held_out_status": "sealed"
  },
  "artifacts": {
    "source": "docs/static/games/src/q728-v1/q728.py",
    "metadata": "research/games/q728-v1.json",
    "win_recording": "research/recordings/q728-v1-win.json",
    "loss_recording": "research/recordings/q728-v1-loss.json",
    "thumbnail": "docs/static/img/games/q728-v1.png",
    "source_sha256": "7a6d7db83893dee8d6d31f294de045e2f37c20d405c6e0773974e3cf2e7132d3"
  },
  "status": "prototype"
}
