{
  "schema_version": 1,
  "game_id": "q779",
  "version": "v1",
  "internal_title": "Strata Rhythm",
  "public_title": null,
  "author_partition": "gpt",
  "authorship": {
    "model_family": "OpenAI GPT-5",
    "model_snapshot": "current Codex task model; exact deployment id not exposed to task",
    "session_id": "01a02a2e-aaf5-7e90-a559-46437ace2edb",
    "created_at": "2026-08-30T00:00:00Z",
    "source_lineage": [
      "research/gpt-ideas-v2.tsv:q779"
    ],
    "source_commit": null
  },
  "mechanics": {
    "primary": "physical-timing-probe-is-undone-while-its-knowledge-guides-a-later-macro-window",
    "secondary": [
      "temporal-abstraction",
      "underrepresented-capability-expansion"
    ],
    "novelty_claim": "Strata Rhythm",
    "closest_prior_art": [
      "research/coverage-gap-study-v1.md",
      "research/flash-game-mechanics-survey.md"
    ]
  },
  "failure_modes": [
    "coordinates one actor locally while ignoring the other actor's independently visible schedule",
    "commits evidence, a relation, a quantity, or an obligation outside the sparse shared event",
    "collapses local-cycle and outer-clock state or forgets persistent identity and probe knowledge"
  ],
  "interface": {
    "actions": [
      1,
      2,
      3,
      4,
      5,
      6
    ],
    "observation": "64x64x16",
    "deterministic": true,
    "seeded_stochasticity": false
  },
  "progression": [
    {
      "level": 1,
      "role": "orient",
      "new_demand": "Single Probe",
      "composes": []
    },
    {
      "level": 2,
      "role": "discriminate",
      "new_demand": "Double Probe",
      "composes": [
        1
      ]
    },
    {
      "level": 3,
      "role": "plan",
      "new_demand": "Whole Routine",
      "composes": [
        1,
        2
      ]
    },
    {
      "level": 4,
      "role": "compose",
      "new_demand": "Restored Window",
      "composes": [
        1,
        2,
        3
      ]
    },
    {
      "level": 5,
      "role": "inhibit",
      "new_demand": "Persistent Timing",
      "composes": [
        1,
        2,
        3,
        4
      ]
    },
    {
      "level": 6,
      "role": "synthesize",
      "new_demand": "Strata Rhythm",
      "composes": [
        1,
        2,
        3,
        4,
        5
      ]
    }
  ],
  "visual_identity": {
    "dominant_palette": [
      6,
      8,
      10,
      11,
      12
    ],
    "silhouette_grammar": "A gray quarry layers fault bands above local, macro, reversible-probe, and knowledge rails.",
    "spatial_grammar": "A gray quarry layers fault bands above local, macro, reversible-probe, and knowledge rails.",
    "motion_grammar": "physical timing probe is undone while its knowledge guides a later macro window",
    "hud_grammar": "Glass colony panes, honeycomb cells, humidity gradients, dual clocks, outer-cycle bars, identity panes, and sparse-event gates expose state without text.",
    "nearest_visual_games": []
  },
  "evaluation": {
    "allowed_development_models": [
      "deterministic-solvers",
      "random-fuzzer",
      "Qwen3.8 diagnostic only"
    ],
    "held_out_evaluator": "anthropic",
    "human_baseline_status": "not_started",
    "held_out_status": "sealed"
  },
  "artifacts": {
    "source": "docs/static/games/src/q779-v1/q779.py",
    "metadata": "research/games/q779-v1.json",
    "win_recording": "research/recordings/q779-v1-win.json",
    "loss_recording": "research/recordings/q779-v1-loss.json",
    "thumbnail": "docs/static/img/games/q779-v1.png",
    "source_sha256": "07ee2fefea0fe79a48f3921e50502be97ed1fb09532c4f22156efdb0bf83f199"
  },
  "status": "prototype"
}
